{
  "paymentGroupNumber": "aute ut dolor",
  "totalReversalAmount": 70979013,
  "id": "magna enim",
  "totalPaymentAmount": 65140841,
  "totalAuthorizationAmount": 92343251,
  "auditInfo": {
    "isDeleted": null,
    "createdBy": "reprehenderit ea eiusmod incididunt",
    "updatedBy": "sed eu nisi minim",
    "updatedDate": null,
    "createdDate": "1967-04-30T17:25:11.128Z"
  }
}
